cleaned_text,sentiment,,,
today abort fund abort provid join togeth put forth bold set demand lay exactli need make sign today learn take action,Positive,,,
christin blasey ford never come forward amp incred brave stori yet anoth proof point brett kavanaugh unfit serv amp nomin withdrawn immedi,Positive,,,
go give give fight decid bodi fire readi go unfpa global leadership meet,Negative,,,
join us webinar may pm et build power solidar w abort fund well explor show moment amp center peopl impact abort ban compassion amp non stigmat way regist,Positive,,,
inspir empow passion engag excit that china special envoy health describ yesterday ecosoc youth forum session follow use join convo,Positive,,,
thank senat democrat vote ye today women health protect act support reproduct freedom need safeguard legal right abort matter happen suprem court,Positive,,,
test trace treat care world health organ call world defeat pandem togeth ever world need,Positive,,,
still believ juli swetnick,Neutral,,,
peopl choos share stori abort help break stigma misconcept thank share abort stori,Positive,,,
offici statement,Neutral,,,
myth trump ban taxpay abort oversea fact kill fund health center even mention abort,Negative,,,
today call strengthen action provid servic mental health young peopl rt agre us health without mental health via,Positive,,,
thank share abort stori help break stigma silenc appreci peopl use privileg platform step boldli space demand compass access us,Positive,,,
men must wake men join fight daughter mother wive assault human digniti freedom,Neutral,,,
today young peopl illinoi longer need parent involv seek abort care let celebr amp uplift win,Positive,,,
believ everyth men meet yrold zahara uganda took role unfpa execut director day she proof anyth set mind rt agre,Neutral,,,
everi teenag right safe success transit adulthood rt agre,Positive,,,
help fund abort restrict state us give via link amp donat split nnaf fund oh ga ky ms al mo la select specif fund donat,Neutral,,,
break scotu refus hear antichoic case louisiana kansa attempt defund plan parenthood rule mean medicaid patient continu access qualiti reproduct healthcar deserv,Neutral,,,
he yet,Neutral,,,
empow help world achiev sustain develop goal rt agre,Positive,,,
feel helpless frustrat news ga al week want make direct impact abort access state right support southern abort fund like,Positive,,,
child marriag violat threaten health live girl around world let commit,Negative,,,
break judg agre halt fetal heartbeat abort law,Neutral,,,
around world choru women voic rise say dr natalia kanem unfpa execut director speak plenari stage women collect voic strength,Positive,,,
realli feel today esp news georgia sixweek abort ban,Negative,,,
import dm us local abort fund social media platform legal medic question pregnancyabort big tech cant trust keep inform safe,Positive,,,
everi time woman speak experi sexual violenc she believ rape cultur flourish everi time hear survivor stori listen believ support via,Negative,,,
break news sexual reproduct health agenc welcom today appoint new deputi execut director appoint announc learn,Neutral,,,
day texa abort fund receiv unpreced number request assist remain effect legal challeng move forward continu inund,Positive,,,
everi young woman abl grow becom whatev choos rt agre,Neutral,,,
thank dr christin blasey ford thank carri unimagin weight thank testifi protect right amp live million stranger inspir hero,Positive,,,
congratul reappoint execut director second term year read via,Neutral,,,
wish women didnt rip past open amp let ogl pain believ us lindi west,Negative,,,
crowd huge major back,Positive,,,
bodili autonomi must protect human right let explain join million peopl around world say,Positive,,,
confirm gorsuch lifetim appt would make overturn step closer becom realiti dem,Neutral,,,
first day life vulner surviv see midwiv provid lifesav care mother newborn babi,Positive,,,
 ,Neutral,,,
women peopl debat,Neutral,,,
romant time coupl girl help say child marriag,Positive,,,
given today bombshel senat shld immedi paus consider stmnt,Neutral,,,
th anniversari roe v wade mean end crimin punish pregnanc outcom famili plan decis medic decis concern one bodi sign plug movement,Negative,,,
rt agre ensur die childbirth matter,Negative,,,
proud endors race repres pennsylvania us senat lieuten governor he steadfast commit reproduct freedom know hell leader fight senat,Positive,,,
peopl across us like get like barrier abort access al exist long ban pass,Neutral,,,
pleas share,Positive,,,
women abort lifetim abort,Neutral,,,
million lack access work protect human right everi woman plan,Positive,,,
stori one hundr thousand transgend nonbinari peopl know reproduct health woman issu human right,Neutral,,,
leadership vision grace pressur youv inspir gener futur leader nasti women,Positive,,,
goal set achiev want studi want play footbal natela today intern day sport develop amp peac celebr like natela inspir girl get game,Positive,,,
hous gop priorit week gun violenc puerto rico chip renew week abort ban,Negative,,,
reproduct right human right reproduct right human right reproduct right human right reproduct right human right reproduct right human right amp rt peopl back hear us,Neutral,,,
rt believ realiti everi pregnant woman,Neutral,,,
georgia week ban deem unconstitut need win yall,Positive,,,
cassidi lie face girl w leukemia would let insur increas rate preex condit,Neutral,,,
zahra survivor femal genit mutil fgm want world know time end harm practic inspir stori join global movement,Positive,,,
l let girl go school open mind learn v vow marri e ensur educ kind love want spread join us help girl say child marriag,Positive,,,
honor evergreen essay mlk legaci continu use coopt antichoic,Positive,,,
paul ryan given nation platform isnt invit tell cnn make ryan,Neutral,,,
strongli condemn strike alahli hospit reportedli kill hundr peopl attack civilian civilian infrastructur must ceas healthcar facil must never target,Negative,,,
must legisl like live depend time action pass women health protect act enshrin fundament human right abort care feder law,Positive,,,
look join us today advoc joint respons,Positive,,,
ye ireland,Neutral,,,
abort still legal,Positive,,,
senat must pass freedom vote john r lewi act consid rule chang allow passag legisl stand firm commit democraci wont endors senat doesnt support path forward,Positive,,,
talk famili abort isnt alway easi your visit love one holiday time year check guid talk abort includ graphic articl toolkit,Positive,,,
world popul billion mani peopl wrong question see becom open human infinit possibl make case right choic,Negative,,,
neera tanden withdraw loss would great leader omb year trump tirad mani senat still wont what right nomin didnt move forward proof doubl standardappli there woman color power,Positive,,,
although devast scotu decis know roe never enough abort fund alway alway make abort access join us amp fight sign onto demand,Negative,,,
unless help million girl remain unabl make decis sexual reproduct health part call world address,Positive,,,
wit show superhero fulli human woman show us new heroth hind heroism call momenti woman face patriarchi weapon voic bodi truth,Positive,,,
let fight togeth fgm latti fight violat four year inspir join movement,Negative,,,
 ,Neutral,,,
break trump admin issu rule roll back birth control coverag million women,Neutral,,,
guess alreadi,Neutral,,,
let clear phrase girl ever forc say get fact see stand girl say child marriag,Positive,,,
drunk consent period,Negative,,,
right enabl individu coupl choos whether children mani uphold right moral imper also path share prosper sustain develop,Positive,,,
birth control cost outofpocket trump new rule hit lowincom women amp women color hardest,Neutral,,,
wont stop everi woman abl exercis includ autonomi bodi unfpa execut director dr natalia kanem kick,Positive,,,
weve help peopl get abort decad here know thread,Positive,,,
wownew zealand pass legisl give domest violenc survivor day paid leav escap abus partner find safeti famili incred step forward,Positive,,,
dont catch bouquet help girl say child marriag,Negative,,,
trump amp penc clearli use margaret atwood fiction playbook rather read pleasur forbid scientist amp research use medic accur terminolog amount yet anoth backdoor tactic curtail basic right amp freedom,Positive,,,
women sri lanka experi sexual harass public transport everi woman deserv come home safe learn,Negative,,,
huge rule clinic shutdown law heart unconstitut,Positive,,,
million american alreadi vote theyv made clear want choos next presid want next presid choos next suprem court justic confirm inaugur,Positive,,,
forc remain pregnant countri incub,Neutral,,,
break cooper veto bill would ban abort week pregnanc ty governor reflect north carolinian protect reproduct freedom welcom develop fight continu,Positive,,,
everyon person belief abort there big differ person belief belief legisl peopl bodi freedom make medic decis debat countri,Positive,,,
thank jort,Positive,,,
look inspir ahead check inspir convo priya chang world better via,Positive,,,
creat emerg fund folk need abort whove affect,Neutral,,,
matter happen roe peopl wont stop abort believ everyon abl manag abort digniti autonomi learn fact medic abort,Positive,,,
tran liber reproduct justic state lawmak tri ban abort push antitran legisl coordin attack bodili autonomi well alway fight world tran folk live freeli safe amp joy,Negative,,,
year ago day dr georg tiller murder antiabort extremist dr tiller steadfast support abort fund nnaf compassion provid peopl need later abort legaci felt appreci everi day,Positive,,,
brett kavanaugh lie multipl time oath confirm hear see document gop work hard conceal usboth amp hearingsit like wors knew,Positive,,,
ban abort emerg contracept famili plan harm dv ipv survivor,Negative,,,
women sexual assault colleg campu devo rescind survivor protect slap face,Positive,,,
pay peopl abort revolutionari polit act redistribut wealth make legal right actual possibl ed via,Positive,,,
separ child doctor famili right surgeri deport anyth prolif,Neutral,,,
everyon love someon abort,Positive,,,
thank women spoken ensur nobodi say bring hous,Positive,,,
fantast thread your new work abort fund,Neutral,,,
trump everi life sacr everi child preciou gift god oh realllllli trump amp gop actual care children theyd work w us restor address amp address obscen rate matern mortal,Positive,,,
donat texa abort fund today late donat divid fund dollar dollar donat match end tonight get give,Neutral,,,
break missouri refus renew licens state abort provid attack reproduct freedom block court missouri becom first state without abort provid friday,Negative,,,
actual feel realli good abl take part normalis idea queer famili,Positive,,,
femin doesnt includ tran women girl femin femin doesnt understand antitran polici disproportion impact bipoc folk particularli black tran women girl femin,Neutral,,,
offici elect women congress right,Positive,,,