cleaned_text,sentiment,,,
coast coast countri countri women stand sexism racism homophobia xenophobia amp hatr,Negative,,,
here fun littl easter egg,Positive,,,
break case challeng mississippi week abort ban mississippi one nine state pass abort ban year ban struck today first recent ban reach feder appel court,Negative,,,
know suprem court announc futur wont today week lot outpour support right social media amp better prepar today come next round rule announc next week,Positive,,,
excit announc transit previou wallet connect function connectkit join like top platform check live,Positive,,,
thank much weve blown away support weve receiv mani peopl donat clinton penc name,Positive,,,
kate desper want abl get care live recov home surround famili kate abil leav state peopl situat like could death sentenc nanci northup presid amp ceo,Positive,,,
polli jackman nation coordin obvious,Neutral,,,
connectkit avail add seamless sign ethereum support add new avatar compon amp other add beauti new noun theme includ numer bug fix improv full releas note,Positive,,,
need get messag march even suprem court announc made current action arrang london edinburgh cardiff want make plan citi pleas contact us want organis,Positive,,,
yesterday state court rule kate favor within hour tx ag ken paxton ask tx suprem court block order amp stop kate abort paxton also issu letter threaten prosecut doctor gave kate abort despit court order,Neutral,,,
tweet asinin time becom parent nullifi one prochoic statu fact women children abort anyon els guess week work ar amp never prochoic life,Neutral,,,
critic health care like birth control cancer screen std test amp peopl alreadi face health dispar,Negative,,,
come home like abort pill allow taken,Positive,,,
kate unabl get abort texa even though fetu fatal condit continu pregnanc threaten futur fertil last week state court rule kate favor within hour tx ag paxton ask scotx block order immedi,Negative,,,
open sourc project github use connectkit thank develop commun help us reach amaz mileston here next,Positive,,,
good news still come plan parenthood,Positive,,,
abort health care,Positive,,,
despit doctor warn kate unabl get abort texa due state extrem abort ban,Negative,,,
brett kavanaugh your victim,Negative,,,
health care freedom act block patient go plan parenthood definit freedom need work,Positive,,,
court said weigh matter stay lower court rule time consid case,Negative,,,
congress amp trump admin remov rule without debat without major amp sign behind close door,Neutral,,,
break iceland new liber abort law gone effect women abl access abort request week pregnanc minor longer oblig obtain parent guardian consent,Positive,,,
alreadi know,Neutral,,,
center reproduct right dedic help peopl access abort commun includ peopl deni care face pregnanc complic youv deni care want speak lawyer option email intakeorg,Positive,,,
pov dump antichoic boyfriend,Negative,,,
want abort abl get one that that tweet,Positive,,,
love pictur wish send mad love amp solidar,Positive,,,
reproduct health care health care health care human right thank stand protect basic freedom,Positive,,,
new version famili avail via testflight updat optim interfac smaller devic introduc better support fail drop transact improv ga fee tray detail inform current ga price,Neutral,,,
abort human right,Neutral,,,
unfortun protest outsid abort clinic dont happen us read inspir young scottish women campaign end harass seek abort servic,Negative,,,
weve blown away outpour support incred brave plaintiff kate cox share stori kate show world abort health care expos truth texass medic except polici doesnt work never meant,Positive,,,
abort moral import health care,Positive,,,
happi friday here invit code wrap week use code famplifi earli access famili spot avail must alreadi testflight access,Neutral,,,
suprem court texa temporarili block order friday yet issu final rule timesensit matter,Negative,,,
famili make easi sort collect way make sens keep track recent addit top bottom view collect artwork order alphabet filter see favorit tap away,Positive,,,
tran famili see care back,Positive,,,
almost week sinc request emerg abort client kate cox due danger obstetr complic kate still hasnt receiv answer texa suprem court whether shell allow get care urgent need,Positive,,,
f u c k ur b n,Neutral,,,
mani thing wife mother profession actor mani year also women countri abort testifi hear,Neutral,,,
sexual assault someon without sexual intercours sexual assault someon know women sexual assault someon know survivor,Negative,,,
break texa requir funer fetal tissu su,Neutral,,,
break day host women empower summit cast decid vote undermin access,Neutral,,,
highli unpreced move appeal court block lower court injunct sixweek abort ban georgia mean state sixweek ban take effect today push abort reach georgian mani even know theyr pregnant,Negative,,,
abort safer get wisdom teeth remov law restrict abort care women health theyr control bodi,Positive,,,
thank amp bring attent high matern mortal rate black women countri racial dispar care led black women die pregnancyrel complic x rate white women must better,Positive,,,
say choic say prochoic join us rd septemb london,Positive,,,
abort crime right,Negative,,,
texa state court right repres texan women deni abort despit seriou pregnanc complic follow thread share live updat zurawski v state texa lawsuit file center reproduct right,Positive,,,
get health care fought,Positive,,,
break judg grant request block georgia week abort ban georgia one five state pass week abort ban year face legal challeng,Negative,,,
rule caus clinic closur around world result unintend pregnanc amp unsaf abort less,Neutral,,,
women us say birth control empow take better care famili say allow complet educ trump chang mani lowincom american lose access afford birth control,Positive,,,
repro right human right repro right human right repro right human right repro right human right repro right human right,Neutral,,,
break main legislatur governor lift hyde amend mainecar insur includ abort coverag,Neutral,,,
voter alabama sent clear messag racism lost tonight sexism lost tonight hatr divis lost tonight,Negative,,,
break us suprem court say hear case could elimin access mifepristoneon two drug use medic abort case file antiabort group seek undo fda approv drug remov market nationwid,Neutral,,,
still believ juli swetnick,Neutral,,,
birth control controversi birth control controversi birth control controversi birth control controversi birth control controversi birth control controversi join,Positive,,,
penc say show respect digniti worth everi person women,Positive,,,
medic abort complicationfre make safer tylenol asprin viagra law restrict abort guis health safeti sham,Positive,,,
dont trust women make choic couldnt said better,Negative,,,
break case challeng mississippi week abort ban fifth circuit alreadi block state week ban week ban even extrem attempt take away right mississippi resid watch,Negative,,,
okay sex okay use birth control okay abort okay restrict access reproduct health care includ safe legal abort,Positive,,,
sinc trend wed like remind everyon black women face higher risk pregnanc complic matern mortal cant support black women twitter must fight provid black women proper reproduct care,Negative,,,
black women like white women die pregnanc childbirthrel caus,Negative,,,
mayb member congress could get pregnant would let women make health care decis,Positive,,,
break today four women came forward join lawsuit state tennesse ask court clarifi scope medic necess except tennesse abort ban,Negative,,,
happi thursday youv patient wait code here chanc use invit code famul earli access famili spot avail must alreadi testflight access,Neutral,,,
attn abort georgia still legal spread word share post georgia women know still receiv care week ban doesnt take effect sue block,Negative,,,
abort safe legal us year refus go backward,Positive,,,
human endur kate famili suffer week state texa must answer abhorr treatment citizen forget,Negative,,,
gaslight v act browbeat person statement odd known fact question saniti mike penc gaslight,Negative,,,
thank scarlett johansson speak american women whove reli plan parenthood care,Positive,,,
huge news advoc florida success gotten number signatur need put constitut amend protect abort right ballot novemb record time,Positive,,,
break new rule trump admin put birth control coverag risk fight back,Negative,,,
north dakota law doctor must tell patient seek abort care abort termin life whole separ uniqu live human ideolog rhetor medic inform su protect doctor free speech,Positive,,,
farewel turn cant flatout lie american peopl plan parenthood,Neutral,,,
break rep ayanna pressley file amend remov hyde feder spend bill hyde block mani peopl mainli lowincom black brown lgbtq folk get abort care thank rep corner,Positive,,,
plan parenthood nonprofit provid health care hand repres organ heart massiv public health crisi credibl take seat,Positive,,,
abort health care abort safe abort woman decis abort human right,Positive,,,
politician like pretend abort ban medic except reason safe human week american front row seat case prove exact opposit,Positive,,,
break unpopular leadership scare vote pull bill floor,Negative,,,
break suprem court struck louisiana clinic shutdown law rule allow state three clinic remain open continu provid abort care peopl louisiana,Positive,,,
break su state georgia block blatantli unconstitut ban abort week pregnanc ban alway block court well make sure one,Negative,,,
new version famili avail via testflight updat add abil set max slippag percentag swap token introduc suggest app search browser much testflight get,Neutral,,,
work hard believ believ america dream anyth anyth togeth achiev anyth unless your woman immigr person color lgbtq,Positive,,,
break win yrlong fight high court kenya issu groundbreak rule declar constitut right kenyan women girl blatantli violat unlaw withdraw standard guidelin safe abort kenya,Positive,,,
 ,Neutral,,,
mani peopl plan parenthood sourc health care,Positive,,,
outrag add insult injuri texa claim amanda zurawski doesnt ground sue fertil compromis result deni abort doesnt worri ban might get pregnant,Negative,,,
good news addit access code avail use code famus earli access famili spot avail must alreadi testflight access,Positive,,,
break trump administr strip titl x fund plan parenthood wisconsin hawaii north carolina virginia southwest ohio put health care risk patient coordin attack block patient come plan parenthood,Negative,,,
en famili,Neutral,,,
thank share abort stori speak law like near total ban abort sign georgia today one four women abort lifetimeit time stop stigma,Positive,,,
scrape bythi time sure cant doubt movement build vote health care access energi peopl power youv built cant wont stop,Positive,,,
dont yet know final outcom know well never stop fight access care pp amp reproduct right,Positive,,,
even made custom sound effect notif type,Neutral,,,
weve detect minor bug affect way certain price chart appear token page work fix expect updat soon thank patienc,Positive,,,
thing abort birth trump posit abort extrem lie american public incit fear amp violenc women make person decis amp abort provid tri provid patient best care possibl,Positive,,,
well share mani access code soon youd like earli access consid give video like rt get code well drop,Positive,,,
unconscion state texa prevent client access health care doctor say desper need fight back,Positive,,,
break feder court spokan rule trump administr earli cut teen pregnanc prevent program grant unlaw,Positive,,,
connectkit avail updat add brand support addit wallet improv develop experi function use connectkit sign ethereum full releas note,Positive,,,
remind american dont want see roe v wade overturn,Negative,,,
gun violenc public health issu gun violenc public health issu gun violenc public health issu gun violenc public health issu gun violenc public health issu gun violenc public health issu,Negative,,,
weve updat develop doc cleaner snappier clearer follow easier ever get run connectkit,Positive,,,
break chile vote lift abort ban case lifeendanger rape amp fatal fetal impair,Negative,,,
defund plan parenthood misnom here get hurt politician attack access care,Negative,,,
one beg court permiss receiv medic care doctor recommend agre need fight get involv liter two click,Positive,,,
thank,Positive,,,
someon love abort someon love need abort everyon deserv access health care that right without judgement punish,Positive,,,
victori scotu allow lower court rule stand medicaid defund case decis protect medicaid patient reli plan parenthood birth control cancer screen std test treatment,Negative,,,
attack access health care wildli unpopular amp would creat nation health disast,Neutral,,,
remind major,Neutral,,,
break leak email show brett kavanaugh doesnt believ roe settl law safe overturn,Positive,,,
access birth control never depend incom job employ opinion,Neutral,,,
dr christin blasey ford believ thank,Positive,,,
someon love ever pregnant probabl know complic aris nowher rapidli becom deadli frighten moment count health care providersnot state bureaucratsto guid us politician belong health care,Positive,,,
break effort defund plan parenthood fail senat great news,Positive,,,
state court baton roug block trigger ban allow abort servic resum state,Negative,,,
rose red violet blue senat vote els come,Neutral,,,
women get abort lifetim dont regret decis fact arent debat,Positive,,,
abort human right start act like,Positive,,,
colombia constitut court decrimin abort week gestat colombia join green tide,Positive,,,
fact check plan parenthood health center medic underserv area,Neutral,,,
updat trigger ban block state court respons lawsuit file earlier today abort care resum louisiana,Negative,,,
america,Neutral,,,
center file emerg relief louisiana socal trigger law behalf abort provid state trigger law immedi effect upon revers crimin abort state,Positive,,,
major morn judg grant request allow plaintiff kate cox emerg relief access abort care texa protect health life futur fertil,Positive,,,
say us reproduct right human right,Neutral,,,
remind american want abort remain safe legal,Positive,,,
peopl say women medic decis women doctor politician,Neutral,,,
million peopl ralli right abort event nationwid around world proud fight continu tell antiabort politician,Positive,,,
break su texa decemb today feder district court block texass unconstitut fetal burial rule,Negative,,,
break idaho court reject state attempt throw case brought women deni abort case seek expand medic except idaho abort ban proceed despit state attempt dismiss case,Negative,,,
today mark th anniversari roe v wade here friendli remind abort safe still legal state everyth keep way,Positive,,,
break news case challeng georgia week abort ban ban clear violat nearli half centuri suprem court preced today rule law prevail abort remain legal state,Negative,,,
abort human right abort human right abort human right abort human right abort human right abort human right abort human right abort human right time lawmak start act like,Positive,,,
break despit massiv opposit trumppenc administr releas uneth gag rule make illeg titl x health care provid refer patient abort,Positive,,,
break news groundbreak histor win women reproduct right ireland vote repeal constitut ban abort,Positive,,,
donald trump put live risk everi singl day remain offic elect clear choic four disastr damag year opportun real chang leadership today endors presid unit state,Positive,,,
break head suprem court announc hear case challeng louisiana admit privileg law allow take effect would leav one doctor provid abort care whole state,Positive,,,
push misinform fake scienc abort later pregnanc show he will say anyth promot antiabort agenda pedal sinc day administr,Negative,,,
presid ceo nanci northup last night explain first time histori oppos scotu nomine tune,Neutral,,,
look pp lapel pin make appear thank show,Positive,,,
help mil peopl access health insur amp mil women get access nocopay birth control,Positive,,,
break announc us senat take anoth vote wednesday first time histori suprem court could verg take away fundament right congress must act protect abort access,Positive,,,
let call attack realli attempt shut health care provid polit reason,Neutral,,,
center reproduct right file emerg lawsuit behalf pregnant woman texa kate cox need urgent abort care due lethal fetal diagnosi threat life health fertil continu pregnanc,Negative,,,
destroy patriarchi planet,Negative,,,
women us abort age mean almost everyon us know someon abort includ lawmak tri ban outright,Negative,,,
negoti away access cancer screen birth control matern care prolif cruel,Negative,,,
list thing presid trump done help women first day offic,Positive,,,
birth control health care isnt add name protect access,Positive,,,
well never back away provid care safe support enviro mil ppl reli,Positive,,,
nobodi wear pp like emma stone stun,Positive,,,
break great news kansa suprem court rule right abort guarante state constitut histor decis reaffirm alreadi know attempt undermin abort access unconstitut,Positive,,,
allow attack health right commun sign say,Negative,,,
youv follow outrag case time get sidelin join movement reproduct right need voic fight ever get involv two click,Negative,,,
break feder court said would block trump admin titl x gag rule would ban provid program refer abortiona victori patient includ plan parenthood patient use titl x care,Negative,,,
break news oklahoma suprem court perman block law restrict access medic abort weve work case nearli year today weve,Negative,,,
repro right human right repro right human right repro right human right repro right human right repro right human right repro right human right repro right human right repro right human right,Neutral,,,
break virginia gener assembl pass reproduct health protect act expand access abort care repeal medic unnecessari restrict made difficult virginian access safe legal abort care year,Positive,,,
happi th birthday woman spent life fight equal notori suprem court justic ruth bader ginsburg,Negative,,,
break feder court prevent texass fetal burial regul take effect litig continu,Neutral,,,
abort human right ban abort inhuman unconstitut,Negative,,,
dont like abort dont get one,Negative,,,
everyon love someon abort decis one four women make lifetim,Positive,,,
american support roe v wade rt your one,Positive,,,
kansa state court block law prohibit doctor provid medic abort via telemedicin decis pave way kansa abort clinic expand servic peopl remot underserv area state,Negative,,,
antiabort restrict struck arkansa amp alabama week huge win repro right,Positive,,,
kate case proven politician judg function standin medic expert abort ban medic except work,Negative,,,
imagin woman miss period goe doctor tell she week pregnant know abort right choic law mississippi governor sign illeg get one well su,Positive,,,
moment ago alaska suprem court rule ban medicaid fund abort care unconstitut weve work case amp sinc weve,Negative,,,
us senat major leader chuck schumer announc senat vote women health protect act februari feder legisl would protect right abort,Positive,,,
happen ralli everi person right access abort outsid us suprem court follow along lawmak advoc storytel share,Positive,,,
say abortioninduc drug describ contracept straight antichoic antisci phrase book use restrict women access essenti health care wont fall shouldnt either,Positive,,,
texass extrem abort ban traumatizedand case nearli kill texa women decid couldnt stay silent theyr reclaim power plaintiff lawsuit state harm endur state draconian ban,Negative,,,
feder district court block personhood lawon would grant right fetus embryo fertil eggsfrom use crimin abort servic,Negative,,,
break hear case mifepriston one medic use medic abort care meantim great news mifepriston remain avail peopl need abort care deserv option includ access medic abort care,Positive,,,
updat week legal whiplash threat prosecut texa attorney gener ken paxton client kate cox forc flee home state texa get timesensit abort care need protect health futur fertil,Positive,,,
break late tonight texa suprem court temporarili halt lower court rule would allow kate cox plaintiff sever pregnanc complic abort protect health futur fertil,Positive,,,
talk urgent medic care kate alreadi week pregnant peopl need beg healthcar court law molli duan senior staff attorney center reproduct right,Positive,,,
break fifth circuit deni mississippi request rehear case challeng state week abort ban defeat ban second time court decemb,Negative,,,
one beg court permiss receiv medic care doctor recommend agre get sidelin get involv fight reproduct right today,Positive,,,
past week legal limbo hellish kate health line she emerg room couldnt wait longer judg politician make healthcar decis pregnant peopl nanci northup,Negative,,,
client kate endur activ medic crisi state texa use health care polit footbal texass action intoler american peopl see unconscion human right violat,Positive,,,
unaccept peopl fear persecut govern simpli access health care doctor say need truth one us could kate everi one us outrag,Positive,,,
huge news judg zurawski v texa case rule favor plaintiff block texa abort ban appli danger pregnanc complic includ fatal fetal diagnos,Negative,,,
still hope court ultim reject state request quickli case fear justic delay justic deni molli duan senior staff attorney center reproduct right,Negative,,,
last week kate receiv confirm fetu lethal conditiontrisomi chanc surviv due kate medic histori obgyn warn continu carri pregnanc could jeopard health futur fertil,Negative,,,
result suprem court revers roe v wade women forc beg urgent healthcar court kate case shown world abort ban danger pregnant peopl except dont work nanci northup,Negative,,,
break feder judg struck mississippi week abort ban rule law prevail polit ploy control person health decis well fight tooth nail make sure ban meet fate,Negative,,,
kate desper want abl get care live recov home surround famili kate abil leav state peopl situat like could death sentenc nanci northup presid amp ceo,Positive,,,
yesterday state court rule kate favor within hour tx ag ken paxton ask tx suprem court block order amp stop kate abort paxton also issu letter threaten prosecut doctor gave kate abort despit court order,Neutral,,,
break case challeng mississippi week abort ban mississippi one nine state pass abort ban year ban struck today first recent ban reach feder appel court,Negative,,,
kate unabl get abort texa even though fetu fatal condit continu pregnanc threaten futur fertil last week state court rule kate favor within hour tx ag paxton ask scotx block order immedi,Negative,,,
despit doctor warn kate unabl get abort texa due state extrem abort ban,Negative,,,
court said weigh matter stay lower court rule time consid case,Negative,,,
center reproduct right dedic help peopl access abort commun includ peopl deni care face pregnanc complic youv deni care want speak lawyer option email intakeorg,Positive,,,
break iceland new liber abort law gone effect women abl access abort request week pregnanc minor longer oblig obtain parent guardian consent,Positive,,,
want law chang women right arent depend marit statu need help donat share,Positive,,,
want abort abl get one that that tweet,Positive,,,
weve blown away outpour support incred brave plaintiff kate cox share stori kate show world abort health care expos truth texass medic except polici doesnt work never meant,Positive,,,
suprem court texa temporarili block order friday yet issu final rule timesensit matter,Negative,,,
abort human right,Neutral,,,
almost week sinc request emerg abort client kate cox due danger obstetr complic kate still hasnt receiv answer texa suprem court whether shell allow get care urgent need,Positive,,,
mani thing wife mother profession actor mani year also women countri abort testifi hear,Neutral,,,
break texa requir funer fetal tissu su,Neutral,,,
highli unpreced move appeal court block lower court injunct sixweek abort ban georgia mean state sixweek ban take effect today push abort reach georgian mani even know theyr pregnant,Negative,,,
abort safer get wisdom teeth remov law restrict abort care women health theyr control bodi,Positive,,,
abort crime right,Negative,,,
texa state court right repres texan women deni abort despit seriou pregnanc complic follow thread share live updat zurawski v state texa lawsuit file center reproduct right,Positive,,,
break judg grant request block georgia week abort ban georgia one five state pass week abort ban year face legal challeng,Negative,,,
women us say birth control empow take better care famili say allow complet educ trump chang mani lowincom american lose access afford birth control,Positive,,,
break us suprem court say hear case could elimin access mifepristoneon two drug use medic abort case file antiabort group seek undo fda approv drug remov market nationwid,Neutral,,,
break main legislatur governor lift hyde amend mainecar insur includ abort coverag,Neutral,,,
penc say show respect digniti worth everi person women,Positive,,,
break today four women came forward join lawsuit state tennesse ask court clarifi scope medic necess except tennesse abort ban,Negative,,,
break case challeng mississippi week abort ban fifth circuit alreadi block state week ban week ban even extrem attempt take away right mississippi resid watch,Negative,,,
medic abort complicationfre make safer tylenol asprin viagra law restrict abort guis health safeti sham,Positive,,,
