cleaned_text,sentiment,,,
naral chart new path forward name make clear mission reproduct freedom,Positive,,,
sinc trend wed like remind everyon black women face higher risk pregnanc complic matern mortal cant support black women twitter must fight provid black women proper reproduct care,Negative,,,
first posit thing women paul ryan done year offic,Neutral,,,
black women like white women die pregnanc childbirthrel caus,Negative,,,
today chang endors criteria reflect commit freedom vote go forward wont endors us senat doesnt support chang senat rule pass vote right legisl democraci line,Positive,,,
human endur kate famili suffer week state texa must answer abhorr treatment citizen forget,Negative,,,
wow reason object insur cover prenat care men pay watch,Positive,,,
attn abort georgia still legal spread word share post georgia women know still receiv care week ban doesnt take effect sue block,Negative,,,
pregnant women access health servic give birth month women need urgent health care protect urg parti abid oblig intern humanitarian law intern human right law,Positive,,,
huge news advoc florida success gotten number signatur need put constitut amend protect abort right ballot novemb record time,Positive,,,
ask girl age tell us mean respons inspir,Neutral,,,
north dakota law doctor must tell patient seek abort care abort termin life whole separ uniqu live human ideolog rhetor medic inform su protect doctor free speech,Positive,,,
women experi violenc lifetim rt agre must revers trend,Neutral,,,
sexual reproduct health agenc advoc right individu decid freeli respons number space time children statement restrict access abort,Negative,,,
politician like pretend abort ban medic except reason safe human week american front row seat case prove exact opposit,Positive,,,
join us congratul unfpa execut director offici sworn secretarygener,Positive,,,
women go back rt let know agre us via,Neutral,,,
hello everyon thank support abort fund nnaf site current show support abort fund donat gift split fund,Positive,,,
break rep ayanna pressley file amend remov hyde feder spend bill hyde block mani peopl mainli lowincom black brown lgbtq folk get abort care thank rep corner,Positive,,,
futur hand sexual reproduct health right human right rt peopl back hear us,Positive,,,
abort health care abort safe abort woman decis abort human right,Positive,,,
suprem court overturn roe decim right abort unit state rule scotu allow mississippi enforc harm week ban abort open door state legislatur restrict ban abort,Negative,,,
girl reli luck go school realiz dream stand girl like hayat say child marriag,Positive,,,
updat back thank everyon support share resourc network pleas find local abort fund give support today,Positive,,,
break suprem court struck louisiana clinic shutdown law rule allow state three clinic remain open continu provid abort care peopl louisiana,Positive,,,
announc appoint dr natalia kanem new unfpa execut director,Neutral,,,
everi damn bodi deserv access repro health resourc love,Positive,,,
break su state georgia block blatantli unconstitut ban abort week pregnanc ban alway block court well make sure one,Negative,,,
menstruat girl women issu human right issu rt agre,Neutral,,,
hello everyon awar site current work solut right thank everyon ralli send support abort fund right well keep updat asap,Positive,,,
outrag add insult injuri texa claim amanda zurawski doesnt ground sue fertil compromis result deni abort doesnt worri ban might get pregnant,Negative,,,
profound sad announc execut director dr babatund osotimehin pass away,Negative,,,
follow local abort fund social media sign newslett abort fund import function repro health right amp justic ecosystem find local fund today redirect main site restor,Neutral,,,
singl man accept tonight spoke sexual assault wear black tuxedo isnt enough need men speak stand besid us fight end sexual assault amp rape cultur,Negative,,,
break win yrlong fight high court kenya issu groundbreak rule declar constitut right kenyan women girl blatantli violat unlaw withdraw standard guidelin safe abort kenya,Positive,,,
girl born complet girl woman ever subject femal genit mutil fgm yet million girl women worldwid undergon fgm million risk dont speed effort learn,Negative,,,
unconscion state texa prevent client access health care doctor say desper need fight back,Positive,,,
hashtag protect women girl rt spread word join movement,Positive,,,
roughli half state outright ban significantli limit abort next year plan immedi restrict live amp go abort matter ever esp peopl alreadi crimin everyday live,Negative,,,
one beg court permiss receiv medic care doctor recommend agre need fight get involv liter two click,Positive,,,
madr moeder motina mre mamma ema ina nne mem mir manman mthair mte umama majka mutter mother matter languag speak love univers happi,Positive,,,
immedi step take read,Neutral,,,
fatmah escap femal genit mutil fgm without urgent action million girl still risk get cut see work around world,Negative,,,
thank share abort stori speak law like near total ban abort sign georgia today one four women abort lifetimeit time stop stigma,Positive,,,
find inform via clinic statu base locat keep uptod state trigger ban visit trigger ban page,Negative,,,
say dont,Neutral,,,
join us thur june pm est build power abort fund webinar well talk build power amp solidar abort fund amp show way center peopl impact abort ban regist,Negative,,,
someon love abort someon love need abort everyon deserv access health care that right without judgement punish,Positive,,,
regret decis unit state deni futur fund lifesav work,Negative,,,
word hatredhealthcar,Neutral,,,
kavanaugh refer birth control abortioninduc drug antisci lie antichoic extremist phrase show right access abort contracept would seriou danger confirm,Negative,,,
hotlin offer confidenti amp privat support miscarriag abort volunt clinician inform abort pill,Positive,,,
there polit ideolog excus support hyde amend translat discrimin poor women women color plain simpl posit endang peopl alreadi face enorm hurdl,Negative,,,
break chile vote lift abort ban case lifeendanger rape amp fatal fetal impair,Negative,,,
call taliban de facto author revers recent decis includ ban women work humanitarian organ women must allow continu lifesav work read statement,Negative,,,
reproduct coercion abus spectrum deni one right bodili autonomi deni one access abort use mental ill rational say peopl shouldnt children offens amp ableist via,Negative,,,
break senat republican effort move forward week abort ban fail senat,Negative,,,
remind major,Neutral,,,
dear hospit clean staff deserv stand ovat outbreak everi singl day year,Positive,,,
abort fund exactli know lot folk learn abort fund nnaf past week want invit learn check needtoknow detail amp share wide,Positive,,,
someon love ever pregnant probabl know complic aris nowher rapidli becom deadli frighten moment count health care providersnot state bureaucratsto guid us politician belong health care,Positive,,,
offer peerbas emot support info via phone text peopl use abort pill hotlin english spanish,Positive,,,
sexism aliv amp well us hous call young ladi doesnt know damn thing she congresswoman,Positive,,,
denounc riseup rhetor abort fund there never import time fund abort riseup divid us refus recogn critic work fund well antiblack transphobia amp antisex worker stanc,Neutral,,,
speak gender inequ amp inspir posit chang around,Neutral,,,
access birth control never depend incom job employ opinion,Neutral,,,
liter brag commit sexual assault tape,Negative,,,
perform prematur deliveri die doctor alshifa hospit tell us extrem suffer pregnant women orphan infant see sexual reproduct health agencyi respond,Negative,,,
women get abort lifetim dont regret decis fact arent debat,Positive,,,
togeth fight futur digniti respect,Positive,,,
im speak tonight,Neutral,,,
could describ one word would,Neutral,,,
state court baton roug block trigger ban allow abort servic resum state,Negative,,,
lindi west nail,Neutral,,,
surpass million dollar abort access,Neutral,,,
 ,Neutral,,,
underway thousand peopl countri worldwid come togeth advanc access sexual reproduct health right take part histor moment transform million live,Neutral,,,
bodi properti state bodi belong us bodi belong us bodi belong us,Neutral,,,
remind mike penc antichoic polici caus liter hiv epidem indiana,Neutral,,,
well keep updat know come day week,Positive,,,
abort human right start act like,Positive,,,
everyon share stori sexual assault thank braveri see believ stand,Neutral,,,
girl first period call menarch sign readi marriag sexual activ childbirth get fact,Neutral,,,
good news marsha jone charg first place pregnanc crimin,Positive,,,
colombia constitut court decrimin abort week gestat colombia join green tide,Positive,,,
year ago world made promis advanc health right women girl time acceler promis,Neutral,,,
wow wi rep scott allen think women forc procreat sake labor market women peopl incub,Positive,,,
rt agre everi woman everi part world right live digniti freedom fear via,Positive,,,
law shame women chill effect convers doctor patient amp noth support actual famili take care love one w syndrom instead exploit part larger strategi systemat make abort illeg,Positive,,,
updat current redirect act blue page well,Positive,,,
announc intent restor fund sexual reproduct health agenc us decis posit impact live women girl countri learn,Neutral,,,
histori look kindli senat whose thirst power led destroy yr senat tradit,Negative,,,
kofi annan embodi principl mentor role model inspir mani legaci live million whose live touch see execut director dr natalia kanem statement pass,Neutral,,,
thank,Positive,,,
updat trigger ban block state court respons lawsuit file earlier today abort care resum louisiana,Negative,,,
told us women didnt matter told us werent enough told us homemakersso took hous congratul badass prochoic congresswomen take capitol hill storm morn,Negative,,,
gender equal women issu issu peac secur issu,Neutral,,,
center file emerg relief louisiana socal trigger law behalf abort provid state trigger law immedi effect upon revers crimin abort state,Positive,,,
age studi learn wive rt agre must,Neutral,,,
nnaf websit still due unpreced traffic donat abort fund full list nnaf abort fund member member avail soon websit back thank,Positive,,,
give women econom freedom make decisionsw know women unrecogn uncompens labor societi,Positive,,,
major morn judg grant request allow plaintiff kate cox emerg relief access abort care texa protect health life futur fertil,Positive,,,
mother bring life world time world stand everi mother life rt believ arent worth celebr also worth save die childbirth learn,Negative,,,
take gut fund abort moment ye shoutout unapologet support abort fund gut tour year read execut director,Positive,,,
break idaho court reject state attempt throw case brought women deni abort case seek expand medic except idaho abort ban proceed despit state attempt dismiss case,Negative,,,
stan thank use platform way destigmat abort,Positive,,,
peopl say women medic decis women doctor politician,Neutral,,,
thank fundrais support messag energi last coupl day lot abort fund indi clinic practic support network,Positive,,,
salut inner girlchild she still hope strong dr natalia kanem execut director start go,Positive,,,
new rule betsi devo would requir univers allow accus sexual abus crossexamin retraumat victim absolut sicken,Negative,,,
fatmah escap femal genit mutil fgm without urgent action million girl still risk get cut togeth work,Negative,,,
messag simpl neither controversi polit women girl count matter right inher us speak hundr deleg includ,Neutral,,,
break su texa decemb today feder district court block texass unconstitut fetal burial rule,Negative,,,
intl day elimin violenc women head call solidar survivor survivor advoc,Positive,,,
romania outlaw access abort contraceptionbi estim women die result unsaf proceduresmatern mortal skyrocketedhundr thousand children turn state orphanag,Negative,,,
abort fund solidar sex worker tire politician attempt punish us control bodi amp malici law harm peopl claim protect,Negative,,,
break news case challeng georgia week abort ban ban clear violat nearli half centuri suprem court preced today rule law prevail abort remain legal state,Negative,,,
billion hope billion dream billion possibl planet home billion peopl get fact,Positive,,,
abort human right abort human right abort human right abort human right abort human right abort human right abort human right abort human right time lawmak start act like,Positive,,,
reproduct freedom mean women abl particip equal fulli countri cant adequ express frustrat assert st centuri senat,Positive,,,
break news groundbreak histor win women reproduct right ireland vote repeal constitut ban abort,Positive,,,
normal hear legitim diann feinstein gave credibl process major american clear want choos next presidentand next presid fill vacanc committe need new leadership,Positive,,,
thousand peopl take shelter alshifa hospit staff tri help pregnant women prematur babi let filmmak bisan ouda show insid hospit hear health worker dire need lifesav support,Positive,,,
break head suprem court announc hear case challeng louisiana admit privileg law allow take effect would leav one doctor provid abort care whole state,Positive,,,
today anniversari tweet stand american support,Positive,,,
everi minut woman die give birth that around women per day see help stop clock make motherhood safer,Negative,,,
break suprem court kansa rule state constitut protect right abort rule mean abort right protect across state kansaseven republican success roll back roe,Positive,,,
presid ceo nanci northup last night explain first time histori oppos scotu nomine tune,Neutral,,,
center reproduct right file emerg lawsuit behalf pregnant woman texa kate cox need urgent abort care due lethal fetal diagnosi threat life health fertil continu pregnanc,Negative,,,
take note women took bill oreilli good riddanc,Positive,,,
hi glad know want help peopl access abort care isnt need creat underground network abort fund alreadi exist join us invit friend network whole follow list,Positive,,,
break announc us senat take anoth vote wednesday first time histori suprem court could verg take away fundament right congress must act protect abort access,Positive,,,
break feder judg block mississippi unconstitut ban abort law allow go effect would crimin abort mani women amp tran nonbinari folk even know theyr pregnant,Negative,,,
women us abort age mean almost everyon us know someon abort includ lawmak tri ban outright,Negative,,,
suprem court let world know go back,Neutral,,,
amp women came bold enough come forward longer stori margin stori print elizabeth moss power speech accept,Positive,,,
join us congratul unfpa goodwil ambassador name person year along silenc breaker voic ignit movement continu inspir million women girl around world,Positive,,,
masculin motherhood coexist deep ari fitz beauti pictur challeng assumpt pregnanc look like,Positive,,,
day chanc chang cours histori replac donald trump compassion leader know reproduct freedom bodi proud endors presid,Positive,,,
youv follow outrag case time get sidelin join movement reproduct right need voic fight ever get involv two click,Negative,,,
break district attorney announc prosecut marsha jone alabama woman indict manslaught miscarri result shot,Neutral,,,
thank card receiv today thank,Positive,,,
break deadli amp harm,Negative,,,
afor new support thank much outpour support offer assist abort fund appreci youd like contact local fund offer assist pleas call email helplin,Positive,,,
list thing presid trump done help women first day offic,Positive,,,
abort freedom,Positive,,,
women health worker critic effort contain theyr work tirelessli fight frontlin let stand solidar celebr lifesav work via,Negative,,,
dont look away tri turn back clock basic human right women come seat,Neutral,,,
break great news kansa suprem court rule right abort guarante state constitut histor decis reaffirm alreadi know attempt undermin abort access unconstitut,Positive,,,
trump transfer power washington dc give back peopl peopl challeng accept,Positive,,,
updat nnaf websit back find local abort fund,Neutral,,,
im im mayor im veteran im feminist im run presid,Neutral,,,
human right cant quarantin see protect right million peopl affect pandem,Negative,,,
friday michigan abort ban block let gooooo,Negative,,,
new get know us abort fund,Neutral,,,
friendli remind everyon particip today,Neutral,,,
intern highlight activist need know,Positive,,,
break news oklahoma suprem court perman block law restrict access medic abort weve work case nearli year today weve,Negative,,,
today th anniversari share stand american support abort access,Positive,,,
abort fund support reproduct justic elimin barrier abort access across countri,Positive,,,
theyr come women theyr come doctor theyr come roe majorityand go back join us street find event near,Positive,,,
femal genit mutil fgm practic come age perform get fact,Neutral,,,
abort,Neutral,,,
uteru busi,Neutral,,,
today special day oriaku njoku shethey take new leadership role execut director nnaf couldnt excit,Positive,,,
one effect speaker histori leadership made aca equal pay amp econom stimulu realiti critic moment believ one better suit lead hous thank leader pelosi,Positive,,,
break virginia gener assembl pass reproduct health protect act expand access abort care repeal medic unnecessari restrict made difficult virginian access safe legal abort care year,Positive,,,
your want talk folk life abort dont know start weve got resourc check hearttoheart abort convers guid power compassion convers around abort,Positive,,,
join us need champion choic say unfpa execut director share festiv stage dakota johnson,Positive,,,
warn given explan nevertheless,Negative,,,
today great day learn work abort fund thing need know understand abort fund also,Positive,,,
happi th birthday woman spent life fight equal notori suprem court justic ruth bader ginsburg,Negative,,,
point whether im grate birth mother didnt abort deserv make choic exist decid entitl,Neutral,,,
break feder court prevent texass fetal burial regul take effect litig continu,Neutral,,,
health worker period tell world check fact period coronaviru pandem,Neutral,,,
everi bodi right reproduct freedom,Positive,,,
vision futur abort access includ world decis around abort safe peac afford join movement love compass support work,Positive,,,
abort human right ban abort inhuman unconstitut,Negative,,,
everyon love someon abort decis one four women make lifetim,Positive,,,
pleas take time read thread thank support desir help,Positive,,,
white supremaci threat public health must work dismantl structur oppress prevent us ever reach true reproduct freedom,Positive,,,
everi singl person right live without fear yet hundr thousand women girl humanitarian crise experienc physic andor sexual violenc must stop,Positive,,,
dont like abort dont get one,Negative,,,
weve seen lot misinform circul say abort illeg us true want make crystal clear still get abort us,Positive,,,
hard keep track statelevel abort restrict protect us here infograph articl help,Positive,,,
pregnant women right access health servic without fear harm health worker healthcar facil must target attack healthcar violat intern humanitarian law,Positive,,,
girl access everyth necessari understand care bodi attend school without stigma shame commit end stigma ensur digniti,Positive,,,
pill final freeee first time us histori overthecount birth control pill proud coalit decad tireless work advocaci,Positive,,,
human right violat everi time girl subject femal genit mutil fgm forc child marriag protect girl health right work,Positive,,,
make harder avoid unintend pregnanc make harder end unintend pregnanc make harder support becom mother must support right choos whether becom mother,Positive,,,
global epidem world observ activ genderbas violenc featur object real case abus,Neutral,,,
go back day abort illeg countri fight back everi singl day,Negative,,,
youv consid destruct abort right slipperi slope healthcar amp famili time rise believ everyon abl creat famili envis need,Negative,,,
hous invest abort fund,Neutral,,,
break evelyn hernndez salvadoran woman serv month year sentenc experienc stillbirth acquit retrial,Positive,,,
wow huge thank gener support friend work put end abort stigma abort funder songwrit could write love song right total would,Positive,,,
face man face consequ action first time life age,Neutral,,,
migrant women never deni right see feminist issu,Neutral,,,
kate case proven politician judg function standin medic expert abort ban medic except work,Negative,,,
updat utah,Neutral,,,
proud prochoic,Positive,,,
big thank donat happi side,Positive,,,
incred speech michel william power choic women vote finish epic takeaway women time vote pleas selfinterest men year,Neutral,,,
girl young women face time genderbas violenc without disabl five thing need know disabl gender discrimin,Neutral,,,
nnaf nearli member fund thrill support releas new singl week demi bold voic unabashedli support abort fund amp need us ed,Positive,,,
head instagram see photo featur x project intern,Neutral,,,
kansa state court block law prohibit doctor provid medic abort via telemedicin decis pave way kansa abort clinic expand servic peopl remot underserv area state,Negative,,,
antiabort restrict struck arkansa amp alabama week huge win repro right,Positive,,,
today abort provid appreci day abort provid make world better place dont know wed without today honor provid listen voic amp give follow,Positive,,,
even your fulli vaccin cdc still recommend interf peopl person privat reproduct healthcar decis,Positive,,,
imagin woman miss period goe doctor tell she week pregnant know abort right choic law mississippi governor sign illeg get one well su,Positive,,,
immigr justic refuge justic reproduct justic solidar attack recent polici,Negative,,,
protect protect other protect protect other follow seven simpl step prevent spread via,Positive,,,
moment ago alaska suprem court rule ban medicaid fund abort care unconstitut weve work case amp sinc weve,Negative,,,
good late break news ky,Positive,,,
american support roe v wade rt your one,Positive,,,
indigen women wors outcom find new fact sheet weve develop,Neutral,,,
speech singl children power defin life goal spite patriarchi stand say life mine,Negative,,,
menstrual hygien day may join us rt agre menstruat never taboo topic let talk,Positive,,,
texass extrem abort ban traumatizedand case nearli kill texa women decid couldnt stay silent theyr reclaim power plaintiff lawsuit state harm endur state draconian ban,Negative,,,
reproduct right human right women right human right back dr natalia kanem unfpa execut director speak th anniversari convent elimin form discrimin women,Neutral,,,
histori made northern ireland,Neutral,,,
today th anniversari landmark case roe v wade legal abort across countri roe alway floor ceil abort care legal doesnt mean access,Positive,,,
father pass away escap child marriag graduat degre civil engin anisa proof educ empow girl achiev dreamseven odd,Negative,,,
us senat major leader chuck schumer announc senat vote women health protect act februari feder legisl would protect right abort,Positive,,,
hostil intensifi echo appeal secretarygener immedi ceasefir protect right peopl,Positive,,,
happen ralli everi person right access abort outsid us suprem court follow along lawmak advoc storytel share,Positive,,,
want futur everyon make reproduct choic best futur requir show amp pitch there better place commun local abort fund find local fund today,Positive,,,
michel william give voic reproduct freedom crucial ive tri best make life make amp wouldnt abl without employ women right choos choos children amp,Positive,,,
femal genit mutil fgm never safe there medic justif harm practic rt join call end medic fgm th session human right council,Negative,,,
delight announc becom nnaf next execut director oriaku njoku shethey join nnaf nearli year experi reproduct health right justic current serv cofound amp ed,Positive,,,
democraci look like,Positive,,,
need news,Neutral,,,
stop use languag blame victim objectifi women normal sexual harass excus rape via,Negative,,,
women abort lifetim kevin williamson argu continu arguemost recent today morn joethat women execut hang antiwoman extremist still given platform spread danger hatr,Negative,,,
realiz reason might abl get pregnant happen law support amanda zurawski lead plaintiff zurawski v texa,Positive,,,
new week goal empow women girl realiz right ambit live equal foot men boy via,Neutral,,,
dont like abort dont one problem solv,Neutral,,,
eman want know religi tradit foundat femal genit mutil fgm learn today,Positive,,,
paus social media next week recognit grief mourn safeti surviv plan need navig histor violent intersect immin white supremacist violenc sedit lethal mismanag global pandem,Negative,,,
believ power girl chang world better chanc child marriag rob mani girl chanc dr natalia kanem unfpa execut director,Negative,,,
would hire intern offic seen resum im tri figur jeopardi would actual wait document what jeopardi wait document lifetim appoint,Neutral,,,
florida pass week ban abort devast consequ peopl alreadi face exist barrier access abort care need,Negative,,,
thing say absolut noth whether sexual assault multipl women women friend hire women coach girl basketbal wife daughter,Negative,,,
year nurs amp midwif year well honor celebr lifesav work togeth stand readi around join us,Positive,,,
