cleaned_text,sentiment,,,
mark second anniversari sinc roe fell pcc proud launch project first kind effort ensur american peopl tool need know right access care coverag matter live,Positive,,,
abort healthcar join volunt donat abort right today join volunt donat,Positive,,,
year ago today savita halappanavar went irish hospit miscarri deni life save abort die today rememb savita,Negative,,,
time congrat northern ireland,Neutral,,,
urgent updat today woman england face sentenc termin pregnanc truli dishearten note maximum penalti could receiv life imprison one harshest punish global,Negative,,,
isnt time broke silenc abort abort common women least one lifetim abort save live abort necessari abort happen everi day alway exist let work ensur safe,Positive,,,
us suprem court announc overturn end year legal right abort us amp devast effect stand solidar fight defend us join london protest us embassi pm tonight,Negative,,,
year ago savita went irish hospit miscarri deni abort die today rememb savita,Negative,,,
health educ choic futur bodi right,Neutral,,,
abort safe abort normal abort common abort healthcar,Positive,,,
hey name arrest sarah everard vigil last year sinc creat platform activ spread awar vawg im take abort right social media day,Negative,,,
never,Neutral,,,
take,Neutral,,,
happi turn join march,Positive,,,
power peopl poland neartot abort ban set implement law monday delay extrem rightw govern follow backlash citizen fight see rule discard soon possibl,Negative,,,
look resist beauti,Neutral,,,
rememb savita year ago today savita halappanavar went hospit galway ireland miscarri deni abort die stori one galvanis movement face becam symbol movement,Negative,,,
time take street abort right march protest decis march us sat juli protest march across us defend stand assembl pm sat juli trafalgar sq march us embassi,Negative,,,
abort normal that that tweet,Neutral,,,
pictur give us feel,Neutral,,,
netherland counter trump intern abort fund sb news,Neutral,,,
challeng your dont say right loud rt youv done let get messag,Neutral,,,
day thank everi one k march us afternoon london shout volunt steward amp speaker solidar us amp roll back,Positive,,,
thank support speaker came parliament squar today repres pro choic major counter protest brilliant noisi confid turn bodi live right decid,Positive,,,
solidar texa abort provid good luck demonstr today kick london today,Positive,,,
lot anger tori allianc antichoic dup come join us parliament squar,Negative,,,
pleas retweet organis solidar protest tonight pm us embassi london,Negative,,,
march front behind samba band mood noisi angri women abort polic bodi real crime,Negative,,,
say choic say prochoic thank speaker steward marcher volunt today london solidar protest loud vibrant visibl say rollback right anywher join,Positive,,,
troubl time ahead,Neutral,,,
need abort abort ireland legal request week avail limit circumst pregnant want abort ireland,Positive,,,
excit announc famili acquir avara team behind famili brand wallet connectkit continu evolv avara umbrella learn,Neutral,,,
goal creat wallet youll enjoy use everi day that pour much time effort make everi last detail feel delight here quick look someth youll like quit often send token,Positive,,,
believ small detail make big differ that weve made import wallet secret recoveri phrase easier suggest word featur scrub word focu one time accuraci faster manual input,Positive,,,
creat first wallet meaning moment famili feel way setup person wallet like watch beauti anim bring life guid everi step way ensur feel confid move forward,Positive,,,
urgent today england motherofthre sentenc month jail selfadminist abort pill unaccept demand urgent reform abort law stand read statement,Positive,,,
driver amp chat ask told said anti abort wife need one,Negative,,,
well keep march campaign abort soon possibl long necessari,Positive,,,
savita,Neutral,,,
woman want fcking abort abl activist writer,Positive,,,
start today well begin share small preview famili new selfcustodi wallet arriv let kick thing someth simpl token brows token famili beauti easi seamless transit delight interact,Positive,,,
stop blame women male violenc dont blame shortcut dont blame outfit dont blame drink blame fuck perpetr,Negative,,,
soon,Neutral,,,
break news mexico take histor step women reproduct right,Neutral,,,
fun updat shini new websit live take look discov famili havent alreadi join waitlist stay loop,Positive,,,
creat best way brows manag nft support uniqu media type seamless fulli custom built experi whether audio video model even interact art famili display collect right,Positive,,,
hello today introduc connectkit power react compon librari ad userfriendli wallet connect experi app come sensibl default box focu build avail public beta,Neutral,,,
speed up famili display way easi understand rather show two separ transact visual bundl clariti transact sped origin mark replac toggl origin context,Neutral,,,
want point much abort right lgbtiq right common fight stigma shame struggl access healthcar everyon know import intersection within movement take pride struggl,Negative,,,
famili great simplifi complex process shown real swap exampl leverag power background step seamlessli transit next provid clear visibl everi stage process,Positive,,,
decis scrap abort telemedicin base consult domin antichoic campaign inform telemedicin decis england made shock k submiss consult one organis right life,Negative,,,
manag multipl wallet challeng famili make easi matter like organ thing quickli see wallet link easili view relat wallet check one exist wallet group secret recoveri phrase,Positive,,,
want pregnant valid choos abort,Positive,,,
big news start today testflight user access famili access code requir updat latest version testflight your good go look forward hear feedback open beta phase enjoy,Positive,,,
pro life lot base comment pictur would need abort nobodi would fuck psa women worth determin desir men,Negative,,,
excit share major featur addit famili preview enabl collabor preview offer unpreced level control transpar navig world ethereum full transact simul much,Positive,,,
there link abort breast cancer there link abort breast cancer there link abort breast cancer there link abort breast cancer there link abort breast cancer,Negative,,,
import action wallet one everi day simpl experi like mint quick seamless execut famili transact request appear clearli blend seamlessli final mint form complet,Positive,,,
weve made easi possibl swap token right within famili quot updat realtim clear way track swap start finish even see path swap took get b your ever curiou,Positive,,,
prochoic organis across us call support everywher march saturday may join abort right march london pm saturday may assembl parliament squar march us embassi nine elm,Positive,,,
understand activ wallet alway incred difficult confus event name minim context surfac famili complet chang activ tab clearli convey wallet care,Positive,,,
famili simplifi manag connect app view control activ connect address switch chain star favorit app disconnect need even disconnect activ tab well updat event reflect new state,Positive,,,
solidar irish women go strike right control bodi,Negative,,,
one way secur wallet back manual famili involv write secret recoveri phrase pass secur quiz select correspond number specif word complet start use wallet right away,Positive,,,
want see wallet activ fun creativ way wallet wrap famili user enjoy uniqu video summari last day onchain share friend keep person memori check march summari,Positive,,,
hail know bodi aint nobodi busi,Positive,,,
nearli beta time here itll work week testflight spot open special invit code requir code releas weekli via twitter enabl tweet notif first know see next tweet detail,Positive,,,
life health educ futur bodi right choic,Neutral,,,
 ,Neutral,,,
wallet wrap avail testflight user like spotifi wrap crypto wallet last day onchain summaris beauti uniqu video everi month everi wallet address avail dark amp light mode,Positive,,,
candl london outsid polish embassi show solidar tonight memori amp protest woman die toxic shock doctor refus abort despit pregnanc unviabl join warsaw say,Negative,,,
wish eth sometim tri send well let know nice youv hit limit,Positive,,,
famili easi use also offer advanc function import exist index featur enabl ad specif address seed phrase youv alreadi import well also show address activ balanc detect,Positive,,,
vote offici solidar allianc choic northern ireland give us opportun shine light state look total isol matter launch campaign today,Neutral,,,
abort right come attack stand fight back,Negative,,,
save recipi costli network fee help set en name advanc send famili easili configur en name send trigger multipl transact background ensur correct setup arriv,Positive,,,
excit unveil famili portrait randomli gener freetoclaim nft kickstart expand collect imag entir uniqu claimabl exclus famili eth requir cover ga fee get one right away,Positive,,,
exitpol show look like win landslid northern,Positive,,,
gm,Neutral,,,
abl watch wallet stay loop one mani fun aspect web famili make easi simpl interfac add viewonli wallet close resembl still keep visual separ wallet manag,Positive,,,
good news weve got testflight spot grab today complet access famili itll get readi releas access code happen often get testflight,Positive,,,
send mad love amp solidar everi obstreper young ladi repeal jumper repeal project,Positive,,,
beauti week start open famili beta,Neutral,,,
maltes hospit refus potenti life save abort us citizen holiday malta doctor choic malta made situat public famili request wont sit silent woman left die,Positive,,,
manag token famili easi draganddrop hide star trash token one time bulk intuit gestur delight interact everi stage realli simpl,Positive,,,
safe legal free,Positive,,,
famili display nft ideal intend format whether imag interact video audio media type here exampl podcast collect within famili ui automat display player full media control,Positive,,,
victori women mp decis vote prochoic amend offenc peopl act vote huge victori women prochoic movement play pivot role thank mani campaign lobbi,Positive,,,
easili hide unwant asset activ famili advanc control filter keep wallet clean streamlin dont let junk asset transact clutter experi,Positive,,,
teessid woman bethani cox face judg alleg selfinduc abort mark fourth case eight month three trial past year decriminalis abort,Neutral,,,
ls come soon famili youll abil view balanc collect offer clear view asset across differ chain includ precis percentag send swap simpli select balanc wish use,Positive,,,
connectkit open sourc excit improv thing alongsid commun consid leav keep ongo develop ps octocat harm make video,Negative,,,
heart burst news,Neutral,,,
introduc connectkit theme builder everi week thousand develop use connectkit creat better wallet connect experi easier ever design perfect theme brand new visual editor get start,Positive,,,
due extrem market condit releas cool stuff soon,Positive,,,
send collect within famili seamless youd expect simpli select item want send collect review transact detail confirm easili monitor statu thing activ tab,Positive,,,
detail everywher,Neutral,,,
possibl chang app icon use famili new set screen weve ad beauti option choos enjoy,Positive,,,
new version famili avail via testflight big one weve ad support multipl ls includ optim arbitrum base amp polygon tackl numer bug roll sever new featur like stealth mode larg balanc display mode,Positive,,,
good compani,Positive,,,
happi friday testflight spot avail today also share access code anyon alreadi app waitingthos get today use code friday access get testflight,Positive,,,
psa women peopl,Neutral,,,
new version famili avail via testflight updat contain varieti improv bug fix expect signific updat come week,Neutral,,,
import regularli check activ approv ensur safeti wallet famili allow easili view current approv includ potenti valu risk recommend action need revok approv time ad secur,Positive,,,
ls come soonfamili style,Neutral,,,
due centuri system discrimin abort ban fall hardest black latina indigen peopl color togeth must fight back elect saw voter give elect offici direct protect restor abort right access,Negative,,,
thank reach k follow weve creat special commemor open editionfcmeshthat mint free zora end enjoy,Positive,,,
break suprem court taken away right abort overturn roe v wade open floodgat state across countri ban abort court fail us far,Negative,,,
abort safe still legal abort safe still legal abort safe still legal abort safe still legal abort safe still legal abort safe still legal abort safe still legal abort safe still legal,Positive,,,
still work polish thing expect chang improv get closer wider releas your interest earli access feel free give us followretweet respond en name well start roll invit soon,Positive,,,
remind american dont want see overturn,Negative,,,
tran women women tran women women tran women women tran women women tran women women,Neutral,,,
thank warm welcom passion make web fun friendli everyon believ start build incred new mobil wallet your proud recommend friend famili cant wait share soon,Positive,,,
birth control controversi birth control controversi birth control controversi sign,Neutral,,,
happi tuesday testflight spot avail today although full access famili youll readi releas access code well week get testflight,Positive,,,
hot press welsh assembl confirm wale offer free abort women ni,Positive,,,
psst drop en give famili followretweet couldnt hurt chanc,Positive,,,
let get word way devast angri shock disgust mark word plan parenthood door stay open,Negative,,,
prolif that lie dont care women die,Positive,,,
kick thing open testflight spot via public link keep eye twitter new access code becom avail come week look way improv odd receiv access code tip turn tweet notif famili stay loop first know releas new testflight spot access code interact us get notic catch attent enthusiasm could gain access amaz support check friend invit code friend particip beta might invit code share give shot,Positive,,,
remind lateterm abort made phrase use antiabort politician confus peopl stigmat abort,Neutral,,,
thank use tour shine spotloght brightli fight reproduct right icon isnt long youv platform icon platform,Neutral,,,
know politician want alreadi happen ban abort state stateamp eventu nation ban like gener us well fight someon know need abort reach plan amp,Negative,,,
leav tonight,Neutral,,,
thrill introduc first version new inapp browser avail famili via testflight featur provid conveni way engag favorit web dapp includ full support bookmark unlimit tab,Positive,,,
defund plan parenthood misnom true intent block million peopl reli medicaid pp health center,Neutral,,,
threaten right stand fight back,Negative,,,
break defeat one vote pp patient get care tomorrow amp peopl across countri breath sigh relief,Positive,,,
famili make easi keep track import contact one simpl place add custom favorit remov wallet address easili address book contact add access later key place choos recipi send,Neutral,,,
word,Neutral,,,
abort health care,Positive,,,
well open testflight spot share initi access code week consid give video like rt might drop,Positive,,,
huge thank everyon turn sad ramp age action amp join protest overturn us embassi last night fantast see short notic well march amp protest amp organis join,Positive,,,
abort oppon realli want lower abort rate theyd work plan parenthood boost birth control amp sex ed,Positive,,,
there line item budget goe plan parenthood simpli reimburs care render like health provid,Positive,,,
happi new year readi clean slate there nft wallet longer want simpli press hold tap trash remov itll move trash section option either burn restor conveni,Positive,,,
legal prosecut women past decad offenc person act clear legal system need reassess updat fit purpos,Positive,,,
first time nearli year plan parenthood forc titl x program mean peopl across countri alreadi struggl make end meet might abl access care need absolut devast,Positive,,,
updat week legal whiplash threat prosecut texa attorney gener ken paxton client kate cox forc flee home state texa get timesensit abort care need protect health futur fertil,Positive,,,
plan parenthood support doesnt come corpor perk discount peopl stand plan parenthood support reproduct health right,Positive,,,
counter extremist group march life,Neutral,,,
new version famili avail via testflight updat bring sever enhanc famili inapp browser includ ui tweak action bar smoother brows experi,Neutral,,,
retweet favourit proud call prochoic let us know your,Positive,,,
break women england allow take second earli abort pill home,Positive,,,
possibl select quantiti nft send use erc token famili among first wallet make featur easili access seamless amount picker appear right confirm transact,Neutral,,,
famili tini detailseveryth design engin ground provid best experi possibl,Positive,,,
statement solidar refus act stop blatant target harass met polic put stella risk send messag fair game harass women seek abort,Negative,,,
abort health care safe legal must remain access wont go back back alley amp unsaf care,Positive,,,
consent sexi consent pregnanc artwork abort embroideri,Positive,,,
want earli access famili well share invit code soon consid give like rt get code well drop,Positive,,,
women peopl,Neutral,,,
break late tonight texa suprem court temporarili halt lower court rule would allow kate cox plaintiff sever pregnanc complic abort protect health futur fertil,Positive,,,
wallet wrap arriv exclus famili soon everi month,Neutral,,,
here pictur leader negoti away birth control matern care amp abort notic anyth ht,Positive,,,
abort decrim ni huge win human right here need know histor moment,Positive,,,
connectkit avail updat fix minor bug improv develop experi full releas note,Neutral,,,
agre bodi state women doctor best posit make inform decis best one els watch full testimoni,Positive,,,
alway good job cover difficult stori season start abort storylin contact us,Positive,,,
abort health care,Positive,,,
 ,Neutral,,,
abort right solidar protest us embassi tonight look futur action,Negative,,,
break suprem court struck louisiana antiabort restrict,Negative,,,
th anniversari savita halappanavar avoid death rememb savita take stock transform ireland braveri determin incred famili campaign tragedi never repeat ireland,Negative,,,
today push new updat famili rang help improv let jump what new sort token collect multipl way includ collect recent highest valu market cap alphabet weve ad brand new trash section dedic place wallet set everyth decid youd like get rid burn restor asset trash time leav sight mind weve improv approv section wallet set revok approv directli within famili without ever leav app weve improv spam detect filter asset activ youll abl autohid spammi unusu activ default open filter tray activ tab adjust set also mark asset spam casebycas basi well remov spam label disagre enjoy,Positive,,,
seek asylum legal right seek asylum legal right seek asylum legal right seek asylum legal right seek asylum legal right seek asylum legal right seek asylum legal right seek asylum legal right,Positive,,,
anyon use invit code familyfirst earli access famili spot avail must alreadi testflight access,Neutral,,,
hey gove high women need week amp here,Neutral,,,
well fight like hell ensur peopl access carebut well need help call,Positive,,,
thank stand choic delight support undeni truth uk prochoic overwhelm major support woman right choos read full respons,Positive,,,
oh lord amend pass peer smash next stop rd read common amp pass bill tomorrow,Negative,,,
weve team great folk offer exclus famili access code member get code must activ fwb member privat discord fwb team distribut code firstcom firstserv basi enjoy fun benefit,Positive,,,
talk urgent medic care kate alreadi week pregnant peopl need beg healthcar court law molli duan senior staff attorney center reproduct right,Positive,,,
want get earli access famili see featur preview consid give tweet like rt,Positive,,,
new version famili avail via testflight updat includ varieti bug fix improv includ improv address book ux improv face id experi unlock app new last updat time nft page polish micro interact,Neutral,,,
break fifth circuit deni mississippi request rehear case challeng state week abort ban defeat ban second time court decemb,Negative,,,
 ,Neutral,,,
connectkit avail updat add eip support enhanc wallet discoveri improv function develop experi use connectkit full releas note,Positive,,,
one beg court permiss receiv medic care doctor recommend agre get sidelin get involv fight reproduct right today,Positive,,,
dive ethereum difficult weve made get first ever nft easi slide finger wallet address claim one famili portrait maximum three claim total within app here look work,Negative,,,
let die izabela name yearold woman left die doctor midwiv poland last septemb thread,Negative,,,
wild invit code appear use code familyfriend earli access famili spot avail must alreadi testflight access,Neutral,,,
past week legal limbo hellish kate health line she emerg room couldnt wait longer judg politician make healthcar decis pregnant peopl nanci northup,Negative,,,
gm,Neutral,,,
right control bodi,Neutral,,,
remind newli appoint leader hous common reesmogg complet oppos abort includ case rape incest make make money misoprostol wonder hypocrit ad ban word list,Negative,,,
beauti morn drop access code use code familiar earli access famili spot avail must alreadi testflight access,Negative,,,
client kate endur activ medic crisi state texa use health care polit footbal texass action intoler american peopl see unconscion human right violat,Positive,,,
vigil outsid irish embassi london halappanavar die year ago deni abort,Negative,,,
comment appoint theres coffey health secretari read statement chair kerri abel,Neutral,,,
one thing weve spent lot time connectkit support variou edg case exampl someon cancel walletconnect request phone scan regener new code fli case want tri help accident dismiss,Positive,,,
pleas note recent secur vulner ledger affect use connectkit unless specif use ledgerconnector app ledger oper sdk similar name ledger connect kit howev way relat famili connectkit packag,Neutral,,,
unaccept peopl fear persecut govern simpli access health care doctor say need truth one us could kate everi one us outrag,Positive,,,
thing abort birth pure propaganda use politician want play polit peopl medic decis,Positive,,,
your look detail breakdown weve share far thread worth look thank compil,Positive,,,
huge news judg zurawski v texa case rule favor plaintiff block texa abort ban appli danger pregnanc complic includ fatal fetal diagnos,Negative,,,
abort right human right abort right human right abort right human right abort right human right,Neutral,,,
impos gag rule cut fund health care provid refer patient abort effect violat medic ethic prevent women get full accur health care take care away million,Positive,,,
still hope court ultim reject state request quickli case fear justic delay justic deni molli duan senior staff attorney center reproduct right,Negative,,,
need realli quickli copi address tap name top wallet easi,Positive,,,
 ,Neutral,,,
abort must safe legal access period,Positive,,,
last week kate receiv confirm fetu lethal conditiontrisomi chanc surviv due kate medic histori obgyn warn continu carri pregnanc could jeopard health futur fertil,Negative,,,
excit sponsor judg new hackathon friend take look detail enter,Positive,,,
connectkit beauti theme anim plenti custom option fit need get quick feel tri contextu preview url,Positive,,,
unpack skew logic anti,Negative,,,
offic sent secur guard block deliveri k petit tell ryan defund plan parenthood,Negative,,,
wow wow wow pal mark nd octob calendar bill pass vote amp unless ni assembl reconven abort decriminalis northern ireland well done everyon involv made histori,Positive,,,
merg final arriv year meticul plan mark import step futur ethereum youd like learn wrote littl post histori merg mean move forward,Positive,,,
result suprem court revers roe v wade women forc beg urgent healthcar court kate case shown world abort ban danger pregnant peopl except dont work nanci northup,Negative,,,
us march today fight health amp right tomorrow amp everi day well win,Positive,,,
health educ choic futur bodi right,Neutral,,,
connectkit avail updat replac walletconnect v walletconnect v break chang develop awar pleas note walletconnect v schedul shut come week full releas note,Neutral,,,
huge sign reproduct health act law big win toward secur safe legal abort amp access contracept cant wait see state follow new york lead protect health right,Positive,,,
excit partner enabl seamless wallet connect connectkitnow live across entir foundat site celebr weve collabor oneoff open edit avail mint foundat free end h,Positive,,,
abort save live abort give peopl power decid futur proudli proabort,Positive,,,
new version famili avail updat includ numer improv peski bug fix happi friday,Neutral,,,
there noth honor undermin birth control access million lowincom women,Positive,,,
break feder judg struck mississippi week abort ban rule law prevail polit ploy control person health decis well fight tooth nail make sure ban meet fate,Negative,,,
islamophobia real white supremaci real hatr real new zealand us matter live deserv better deserv live free fear violenc,Positive,,,
ar call demonstr urg govern end human right violat northern irish women join us tuesday pm outsid facebook event,Positive,,,
